"","title_data","paper_id","source","type","year","author1_data"
"121","Integrated Approach to Sand Management in Mature-Field Operations","          1015-0097-JPT ","          SPE ","          Journal Paper",2015,"Carpenter, Chris, JPT Technology Editor"
"122","Interview with Ana Zambelli","          0110-010-TWA ","          SPE ","          Journal Paper",2010,"Zambelli, Ana, Schlumberger"
"123","World Energy Beyond 2050","          0103-0034-JPT ","          SPE ","          Journal Paper",2003,"Skov, Arlie M., _"
"124","EOR-Feasibility Study for a Large Carbonate Field in Kuwait","          0116-0053-JPT ","          SPE ","          Journal Paper",2016,"Carpenter, Chris, JPT Technology Editor"
"125","Refracturing: A Second Chance To Get It Right Through Diagnostics","          0116-0063-JPT ","          SPE ","          Journal Paper",2016,"Carpenter, Chris, JPT Technology Editor"
"126","Designing an Optimized Surfactant Flood in the Bakken","          0116-0058-JPT ","          SPE ","          Journal Paper",2016,"Carpenter, Chris, JPT Technology Editor"
"127","Oil Recovery From Thin Heavy-Oil Reservoirs: The Case of the Combined-Thermal-Drive Pilot in the Morgan Field","          150593-PA ","          SPE ","          Journal Paper",2013,"Gutiérrez, Dubert, Computer Modelling Group Limited"
"128","Unique CO2-Injection Experience in the Bati Raman Field May Lead to a Proposal of EOR/Sequestration CO2 Network in the Middle East","          139616-PA ","          SPE ","          Journal Paper",2012,"Sahin, Secaeddin, Turkish Petroleum Corporation"
"129","Enhanced Oil Recovery by CO2 Miscible Displacement in the Little Knife Field, Billings County, North Dakota","          10696-PA ","          SPE ","          Journal Paper",1984,"Desch, John B., Gulf Oil E and P Co."
"130","Oil Recovery From Gas-Over-Bitumen Reservoirs: Results From the AIDROH Pilot Project in Alberta","          174455-PA ","          SPE ","          Journal Paper",2015,"Hogue, Bill, Cenovus Energy"
"131","Investigation of Biodiesel-Based Drilling Fluid, Part 1: Biodiesel Evaluation, Invert-Emulsion Properties, and Development of a Novel Emulsifier Package","          180918-PA ","          SPE ","          Journal Paper",2016,"Li, Wai, China University of Petroleum (Beijing)"
"132","Video:                  Optimizing Number of Fractures in Horizontal Well","          174772-PT ","          SPE ","          Presentation",2015,"Guk, Vyacheslav, IHS Global"
